{"$schema":"https://json-schema.org/draft/2020-12/schema","$id":"rus.source_records.v1","type":"array","items":{"type":"object","required":["id","title","source_type","summary","status","confidence"],"properties":{"id":{"type":"string","minLength":1},"title":{"type":"string","minLength":1},"source_type":{"enum":["book","article","chronicle","academic_database","museum","map","archaeology","web","project_note","llm_draft","manual_entry"]},"summary":{"type":"string","minLength":1},"status":{"enum":["draft","usable_with_caution","approved","needs_review","conflict","rejected"]},"confidence":{"enum":["unknown","low","medium_low","medium","medium_high","high"]}},"additionalProperties":false}}
